{
  "safes": [
    {
      "id": "safe-1",
      "investor_name": "Synthetic Investor",
      "purchase_amount": 500000,
      "post_money_valuation_cap": 10000000,
      "form": "yc_postmoney_cap",
      "discount_multiplier": null,
      "issuance_date": "2025-01-15",
      "extraction_confidence": "high"
    }
  ],
  "convertible_notes": [],
  "warrants": [],
  "option_grants": [],
  "metadata": {
    "run_id": "R-acq-synthetic-01",
    "schema_version": "v0.5.0-instruments"
  }
}
